{
	"diagnostics": [],
	"edges": [
		{
			"kind": "extends",
			"member_links": [],
			"source": "native://CanvasItem",
			"target": "native://Node"
		},
		{
			"kind": "extends",
			"member_links": [],
			"source": "native://CanvasLayer",
			"target": "native://Node"
		},
		{
			"kind": "extends",
			"member_links": [],
			"source": "native://Control",
			"target": "native://CanvasItem"
		},
		{
			"kind": "extends",
			"member_links": [],
			"source": "native://MainLoop",
			"target": "native://Object"
		},
		{
			"kind": "extends",
			"member_links": [],
			"source": "native://Node2D",
			"target": "native://CanvasItem"
		},
		{
			"kind": "extends",
			"member_links": [],
			"source": "native://Node3D",
			"target": "native://Node"
		},
		{
			"kind": "extends",
			"member_links": [],
			"source": "native://Node",
			"target": "native://Object"
		},
		{
			"kind": "extends",
			"member_links": [],
			"source": "native://RefCounted",
			"target": "native://Object"
		},
		{
			"kind": "extends",
			"member_links": [],
			"source": "native://Resource",
			"target": "native://RefCounted"
		},
		{
			"kind": "extends",
			"member_links": [],
			"source": "native://SceneTree",
			"target": "native://MainLoop"
		},
		{
			"kind": "extends",
			"member_links": [],
			"source": "native://Script",
			"target": "native://Resource"
		},
		{
			"kind": "extends",
			"member_links": [],
			"source": "res://addons/example_dependency_framework/combat_entity.gd",
			"target": "native://Node"
		},
		{
			"kind": "extends",
			"member_links": [],
			"source": "res://examples/showcase/actors/base_actor.gd",
			"target": "res://addons/example_dependency_framework/combat_entity.gd"
		},
		{
			"kind": "extends",
			"member_links": [],
			"source": "res://examples/showcase/actors/enemy_actor.gd",
			"target": "res://examples/showcase/actors/base_actor.gd"
		},
		{
			"kind": "extends",
			"member_links": [],
			"source": "res://examples/showcase/actors/player_actor.gd",
			"target": "res://examples/showcase/actors/base_actor.gd"
		},
		{
			"kind": "extends",
			"member_links": [],
			"source": "res://examples/showcase/controllers/battle_controller.gd",
			"target": "native://Node"
		},
		{
			"kind": "extends",
			"member_links": [],
			"source": "res://examples/showcase/data/weapon_profile.gd",
			"target": "native://Resource"
		},
		{
			"kind": "extends",
			"member_links": [],
			"source": "res://examples/showcase/runtime/showcase_main_loop.gd",
			"target": "native://SceneTree"
		},
		{
			"kind": "extends",
			"member_links": [],
			"source": "res://examples/showcase/services/damage_service.gd",
			"target": "native://RefCounted"
		},
		{
			"kind": "extends",
			"member_links": [],
			"source": "res://examples/showcase/services/targeting_service.gd",
			"target": "native://RefCounted"
		},
		{
			"kind": "extends",
			"member_links": [],
			"source": "res://examples/showcase/views/battle_hud.gd",
			"target": "native://CanvasLayer"
		},
		{
			"kind": "extends",
			"member_links": [],
			"source": "res://examples/showcase/views/battle_panel.gd",
			"target": "native://Control"
		},
		{
			"kind": "extends",
			"member_links": [],
			"source": "res://examples/showcase/world/ambient_marker.gd",
			"target": "native://Node2D"
		},
		{
			"kind": "extends",
			"member_links": [],
			"source": "res://examples/showcase/world/arena_anchor.gd",
			"target": "native://Node3D"
		},
		{
			"kind": "type_uses",
			"member_links": [
				{
					"evidence": "property_type",
					"source_location": {
						"column": 1,
						"line": 8
					},
					"source_member": {
						"kind": "property",
						"name": "weapon_profile",
						"source_location": {
							"column": 1,
							"line": 8
						}
					},
					"target_member": {}
				}
			],
			"source": "res://examples/showcase/actors/base_actor.gd",
			"target": "res://examples/showcase/data/weapon_profile.gd"
		},
		{
			"kind": "type_uses",
			"member_links": [
				{
					"evidence": "method_return_type",
					"source_location": {
						"column": 1,
						"line": 13
					},
					"source_member": {
						"kind": "method",
						"name": "create_default_profile",
						"source_location": {
							"column": 1,
							"line": 13
						}
					},
					"target_member": {}
				}
			],
			"source": "res://examples/showcase/actors/enemy_actor.gd",
			"target": "native://Resource"
		},
		{
			"kind": "type_uses",
			"member_links": [
				{
					"evidence": "property_type",
					"source_location": {
						"column": 1,
						"line": 6
					},
					"source_member": {
						"kind": "property",
						"name": "weapon_profile_script",
						"source_location": {
							"column": 1,
							"line": 6
						}
					},
					"target_member": {}
				}
			],
			"source": "res://examples/showcase/actors/enemy_actor.gd",
			"target": "native://Script"
		},
		{
			"kind": "type_uses",
			"member_links": [
				{
					"evidence": "property_type",
					"source_location": {
						"column": 1,
						"line": 5
					},
					"source_member": {
						"kind": "property",
						"name": "damage_service_script",
						"source_location": {
							"column": 1,
							"line": 5
						}
					},
					"target_member": {}
				}
			],
			"source": "res://examples/showcase/actors/player_actor.gd",
			"target": "native://Script"
		},
		{
			"kind": "type_uses",
			"member_links": [
				{
					"evidence": "method_argument_type",
					"source_location": {
						"column": 1,
						"line": 18
					},
					"source_member": {
						"kind": "method",
						"name": "finish_battle",
						"source_location": {
							"column": 1,
							"line": 18
						}
					},
					"target_member": {}
				},
				{
					"evidence": "signal_argument_type",
					"source_location": {
						"column": 1,
						"line": 6
					},
					"source_member": {
						"kind": "signal",
						"name": "battle_finished",
						"source_location": {
							"column": 1,
							"line": 6
						}
					},
					"target_member": {}
				}
			],
			"source": "res://examples/showcase/controllers/battle_controller.gd",
			"target": "res://examples/showcase/actors/base_actor.gd"
		},
		{
			"kind": "type_uses",
			"member_links": [
				{
					"evidence": "method_argument_type",
					"source_location": {
						"column": 1,
						"line": 6
					},
					"source_member": {
						"kind": "method",
						"name": "calculate_damage",
						"source_location": {
							"column": 1,
							"line": 6
						}
					},
					"target_member": {}
				}
			],
			"source": "res://examples/showcase/services/damage_service.gd",
			"target": "res://examples/showcase/data/weapon_profile.gd"
		},
		{
			"kind": "type_uses",
			"member_links": [
				{
					"evidence": "method_argument_type",
					"source_location": {
						"column": 1,
						"line": 5
					},
					"source_member": {
						"kind": "method",
						"name": "choose_target",
						"source_location": {
							"column": 1,
							"line": 5
						}
					},
					"target_member": {}
				},
				{
					"evidence": "method_return_type",
					"source_location": {
						"column": 1,
						"line": 5
					},
					"source_member": {
						"kind": "method",
						"name": "choose_target",
						"source_location": {
							"column": 1,
							"line": 5
						}
					},
					"target_member": {}
				}
			],
			"source": "res://examples/showcase/services/targeting_service.gd",
			"target": "res://examples/showcase/actors/base_actor.gd"
		},
		{
			"kind": "type_uses",
			"member_links": [
				{
					"evidence": "property_type",
					"source_location": {
						"column": 1,
						"line": 6
					},
					"source_member": {
						"kind": "property",
						"name": "controller_script",
						"source_location": {
							"column": 1,
							"line": 6
						}
					},
					"target_member": {}
				}
			],
			"source": "res://examples/showcase/views/battle_hud.gd",
			"target": "native://Script"
		},
		{
			"kind": "uses",
			"member_links": [
				{
					"evidence": "class_member_access",
					"source_location": {
						"column": 9,
						"line": 18
					},
					"source_member": {
						"kind": "method",
						"name": "attack_power",
						"source_location": {
							"column": 1,
							"line": 17
						}
					},
					"target_member": {
						"kind": "method",
						"name": "calculate_damage",
						"source_location": {
							"column": 1,
							"line": 6
						}
					}
				}
			],
			"source": "res://examples/showcase/actors/base_actor.gd",
			"target": "res://examples/showcase/services/damage_service.gd"
		},
		{
			"kind": "uses",
			"member_links": [
				{
					"evidence": "load",
					"source_location": {
						"column": 37,
						"line": 6
					},
					"source_member": {
						"kind": "property",
						"name": "weapon_profile_script",
						"source_location": {
							"column": 1,
							"line": 6
						}
					},
					"target_member": {}
				}
			],
			"source": "res://examples/showcase/actors/enemy_actor.gd",
			"target": "res://examples/showcase/data/weapon_profile.gd"
		},
		{
			"kind": "uses",
			"member_links": [
				{
					"evidence": "preload",
					"source_location": {
						"column": 37,
						"line": 5
					},
					"source_member": {
						"kind": "property",
						"name": "damage_service_script",
						"source_location": {
							"column": 1,
							"line": 5
						}
					},
					"target_member": {}
				}
			],
			"source": "res://examples/showcase/actors/player_actor.gd",
			"target": "res://examples/showcase/services/damage_service.gd"
		},
		{
			"kind": "uses",
			"member_links": [
				{
					"evidence": "preload",
					"source_location": {
						"column": 33,
						"line": 6
					},
					"source_member": {
						"kind": "property",
						"name": "controller_script",
						"source_location": {
							"column": 1,
							"line": 6
						}
					},
					"target_member": {}
				}
			],
			"source": "res://examples/showcase/views/battle_hud.gd",
			"target": "res://examples/showcase/controllers/battle_controller.gd"
		}
	],
	"errors": [],
	"metadata": {